Symbol,Name,Price,$ Change,% Change,Quantity,$ Unrealized Gain/Loss,% Unrealized Gain/Loss,Current Balance
VBTLX,Vanguard Total Bond Market Index Fund,$9.81,+$0.50,+0.25%,480.000,–,–,"$4,708.80"
VFIAX,Vanguard 500 Index Fund,$628.68,+$0.50,+0.25%,9.000,–,–,"$5,658.12"
VWO,Vanguard FTSE Emerging Markets ETF,$55.89,+$0.50,+0.25%,72.000,–,–,"$4,024.08"
AVDV,Avantis Intl Small Cap Value ETF,$103.88,+$0.50,+0.25%,24.000,–,–,"$2,493.12"
VMFXX,Vanguard Federal Money Market Fund,$1.00,+$0.50,+0.25%,2400.000,–,–,"$2,400.00"
Total,,,,,,,,"$19,284.12"
